id,site,job_url,job_url_direct,title,company,location,date_posted,job_type,salary_source,interval,min_amount,max_amount,currency,is_remote,job_level,job_function,listing_type,emails,description,company_industry,company_url,company_logo,company_url_direct,company_addresses,company_num_employees,company_revenue,company_description,skills,experience_range,company_rating,company_reviews_count,vacancy_count,work_from_home_type
in-57b16f1a06d4b6d7,indeed,https://www.indeed.com/viewjob?jk=57b16f1a06d4b6d7,https://careers.google.com/jobs/results/126305833876103878-strategic-partner-development-manager/,"Strategic Partner Development Manager, Android",Google,"Mountain View, CA, US",2025-05-08,fulltime,,,,,,False,,,,,"This role may also be located in our Playa Vista, CA campus.
  
**Applicants in the County of Los Angeles:** Qualified applications with arrest or conviction records will be considered for employment in accordance with the Los Angeles County Fair Chance Ordinance for Employers and the California Fair Chance Act.
  
**Note:** By applying to this position you will have an opportunity to share your preferred working location from the following: Mountain View, CA, USA; Los Angeles, CA, USA; Seattle, WA, USA; San Francisco, CA, USA.
  
  

**Minimum qualifications:**  

* Bachelor's degree, or equivalent practical experience.
* 10 years of experience in business development, partnerships, or management consulting, in the Consumer Electronics, OEMs, Telecom, Apps, or Technology industries.
* Experience in managing agreements or partnerships.
* Experience in working with C\-level executives and cross\-functionally across all levels of management.


**Preferred qualifications:**  

* Experience in business with a mobile platform and knowledge of Internet technologies.
* Experience in coding, database manipulation (e.g., SQL), or financial modeling, and understanding of consumer electronics and the mobile value chain.
* Ability to turn a high level concept into a well defined narrative with executive ready materials.
* Ability to be creative, results driven, zoom from strategy to execution, business minded, and collaborative.
* Ability to have a firm sense of accountability and ownership.
* Excellent communication and quantitative problem\-solving skills.


About the job
  
  

Google's line of products and services to our clients never stops growing. The Partnerships Development team is responsible for seeking and exploring new opportunities with Google's partners. Equipped with your business acumen and extensive product knowledge, you are right on the front line of interacting with our partners, and helping them find ways to grow using Google's newest product offerings. Your knowledge of relevant verticals and relationships with key industry players will help shape our great applications and content for products such as YouTube, Google TV and Commerce.
  
Android is the first platform most people will use when they come online. The Android team at Google has built that reality over the last decade, in partnership with a global network of industry leading companies and individuals to form the Android ecosystem. The Android Platform Partnerships team at Google manages that ecosystem. We help partners realize the mutual benefit from making, distributing and connecting Android\-based products for users throughout the world. Central to this is the Android platform itself, provided open source at “Google scale” for free to anyone.As a Strategic Partnerships Development Manager, you will help grow and cultivate Google’s mobile ecosystems, leading growth, distribution, and strategic product partnerships by manufacturing partners and programs.
  
In this role, you will be responsible for identifying key industry trends, representing the partners and identifying distinct opportunities in collaboration with them, and following through with the execution of business development efforts to transform opportunity into action.
  
Android is Google’s open\-source mobile operating system powering more than 3 billion devices worldwide. Android is about bringing computing to everyone in the world. We believe computing is a super power for good, enabling access to information, economic opportunity, productivity, connectivity between friends and family and more. We think everyone in the world should have access to the best computing has to offer. We provide the platform for original equipment manufacturers (OEMs) and developers to build compelling computing devices (smartphones, tablets, TVs, wearables, etc) that run the best apps/services for everyone in the world.
  
The US base salary range for this full\-time position is $168,000\-$249,000 \+ bonus \+ equity \+ benefits. Our salary ranges are determined by role, level, and location. Within the range, individual pay is determined by work location and additional factors, including job\-related skills, experience, and relevant education or training. Your recruiter can share more about the specific salary range for your preferred location during the hiring process.
  
Please note that the compensation details listed in US role postings reflect the base salary only, and do not include bonus, equity, or benefits. Learn more aboutbenefits at Google.
  
  

Responsibilities
  
  

* Identify, create, plan, and implement effective business development agreements that drive results across the Android platform business.
* Maintain consultative business relationships with hardware partners and gain exposure to partners business initiatives to positively impact platform ecosystem proliferation.
* Collaborate with cross\-functional teams to structure and execute business initiatives, develop work plans, lead analysis and develop and communicate final recommendations.
* Forecast and report business growth and other key metrics, track actual progress toward forecasts, drive new business opportunities and ensure the prompt and proper resolution of business issues with partners.
* Lead business reviews with partners and offer a strategic and investigative perspective of the partnership, identifying areas for improvement and growth.


Google is proud to be an equal opportunity workplace and is an affirmative action employer. We are committed to equal employment opportunity regardless of race, color, ancestry, religion, sex, national origin, sexual orientation, age, citizenship, marital status, disability, gender identity or Veteran status. We also consider qualified applicants regardless of criminal histories, consistent with legal requirements. See alsoGoogle's EEO Policy andEEO is the Law. If you have a disability or special need that requires accommodation, please let us know by completing ourAccommodations for Applicants form.",,https://www.indeed.com/cmp/Google,https://d2q79iu7y748jz.cloudfront.net/s/_squarelogo/256x256/fff4be3829cee39e477a518f55475f44,http://goo.gle/3ygdkgv,"Mountain View, CA","10,000+",more than $10B (USD),Our mission is to organize the world’s information and make it universally accessible and useful. ,,,,,,
in-e63e6fab346479d2,indeed,https://www.indeed.com/viewjob?jk=e63e6fab346479d2,https://careers.google.com/jobs/results/126305833876103878-strategic-partner-development-manager/,"Strategic Partner Development Manager, Android",Google,"San Francisco, CA, US",2025-05-08,fulltime,,,,,,False,,,,,"This role may also be located in our Playa Vista, CA campus.
  
**Applicants in the County of Los Angeles:** Qualified applications with arrest or conviction records will be considered for employment in accordance with the Los Angeles County Fair Chance Ordinance for Employers and the California Fair Chance Act.
  
**Note:** By applying to this position you will have an opportunity to share your preferred working location from the following: Mountain View, CA, USA; Los Angeles, CA, USA; Seattle, WA, USA; San Francisco, CA, USA.
  
  

**Minimum qualifications:**  

* Bachelor's degree, or equivalent practical experience.
* 10 years of experience in business development, partnerships, or management consulting, in the Consumer Electronics, OEMs, Telecom, Apps, or Technology industries.
* Experience in managing agreements or partnerships.
* Experience in working with C\-level executives and cross\-functionally across all levels of management.


**Preferred qualifications:**  

* Experience in business with a mobile platform and knowledge of Internet technologies.
* Experience in coding, database manipulation (e.g., SQL), or financial modeling, and understanding of consumer electronics and the mobile value chain.
* Ability to turn a high level concept into a well defined narrative with executive ready materials.
* Ability to be creative, results driven, zoom from strategy to execution, business minded, and collaborative.
* Ability to have a firm sense of accountability and ownership.
* Excellent communication and quantitative problem\-solving skills.


About the job
  
  

Google's line of products and services to our clients never stops growing. The Partnerships Development team is responsible for seeking and exploring new opportunities with Google's partners. Equipped with your business acumen and extensive product knowledge, you are right on the front line of interacting with our partners, and helping them find ways to grow using Google's newest product offerings. Your knowledge of relevant verticals and relationships with key industry players will help shape our great applications and content for products such as YouTube, Google TV and Commerce.
  
Android is the first platform most people will use when they come online. The Android team at Google has built that reality over the last decade, in partnership with a global network of industry leading companies and individuals to form the Android ecosystem. The Android Platform Partnerships team at Google manages that ecosystem. We help partners realize the mutual benefit from making, distributing and connecting Android\-based products for users throughout the world. Central to this is the Android platform itself, provided open source at “Google scale” for free to anyone.As a Strategic Partnerships Development Manager, you will help grow and cultivate Google’s mobile ecosystems, leading growth, distribution, and strategic product partnerships by manufacturing partners and programs.
  
In this role, you will be responsible for identifying key industry trends, representing the partners and identifying distinct opportunities in collaboration with them, and following through with the execution of business development efforts to transform opportunity into action.
  
Android is Google’s open\-source mobile operating system powering more than 3 billion devices worldwide. Android is about bringing computing to everyone in the world. We believe computing is a super power for good, enabling access to information, economic opportunity, productivity, connectivity between friends and family and more. We think everyone in the world should have access to the best computing has to offer. We provide the platform for original equipment manufacturers (OEMs) and developers to build compelling computing devices (smartphones, tablets, TVs, wearables, etc) that run the best apps/services for everyone in the world.
  
The US base salary range for this full\-time position is $168,000\-$249,000 \+ bonus \+ equity \+ benefits. Our salary ranges are determined by role, level, and location. Within the range, individual pay is determined by work location and additional factors, including job\-related skills, experience, and relevant education or training. Your recruiter can share more about the specific salary range for your preferred location during the hiring process.
  
Please note that the compensation details listed in US role postings reflect the base salary only, and do not include bonus, equity, or benefits. Learn more aboutbenefits at Google.
  
  

Responsibilities
  
  

* Identify, create, plan, and implement effective business development agreements that drive results across the Android platform business.
* Maintain consultative business relationships with hardware partners and gain exposure to partners business initiatives to positively impact platform ecosystem proliferation.
* Collaborate with cross\-functional teams to structure and execute business initiatives, develop work plans, lead analysis and develop and communicate final recommendations.
* Forecast and report business growth and other key metrics, track actual progress toward forecasts, drive new business opportunities and ensure the prompt and proper resolution of business issues with partners.
* Lead business reviews with partners and offer a strategic and investigative perspective of the partnership, identifying areas for improvement and growth.


Google is proud to be an equal opportunity workplace and is an affirmative action employer. We are committed to equal employment opportunity regardless of race, color, ancestry, religion, sex, national origin, sexual orientation, age, citizenship, marital status, disability, gender identity or Veteran status. We also consider qualified applicants regardless of criminal histories, consistent with legal requirements. See alsoGoogle's EEO Policy andEEO is the Law. If you have a disability or special need that requires accommodation, please let us know by completing ourAccommodations for Applicants form.",,https://www.indeed.com/cmp/Google,https://d2q79iu7y748jz.cloudfront.net/s/_squarelogo/256x256/fff4be3829cee39e477a518f55475f44,http://goo.gle/3ygdkgv,"Mountain View, CA","10,000+",more than $10B (USD),Our mission is to organize the world’s information and make it universally accessible and useful. ,,,,,,
in-d8ea4d588b38b9a9,indeed,https://www.indeed.com/viewjob?jk=d8ea4d588b38b9a9,https://JPMorganChase.contacthr.com/147399782,Backend Senior Lead Software Engineer,JPMorganChase,"Palo Alto, CA, US",2025-05-08,fulltime,direct_data,yearly,171000.0,260000.0,USD,False,,,,,"**JOB DESCRIPTION**  

Be an integral part of an agile team that's constantly pushing the envelope to enhance, build, and deliver top\-notch technology products.


As a Senior Lead Software Engineer at JPMorgan Chase within Commercial \& Investment Bank, Payments Technology, you are an integral part of an agile team that works to enhance, build, and deliver trusted market\-leading technology products in a secure, stable, and scalable way. Drive significant business impact through your capabilities and contributions, and apply deep technical expertise and problem\-solving methodologies to tackle a diverse array of challenges that span multiple technologies and applications.

**Job responsibilities**

* Regularly provides technical guidance and direction to support the business and its technical teams, contractors, and vendors
* Develops secure and high\-quality production code, and reviews and debugs code written by others
* Drives decisions that influence the product design, application functionality, and technical operations and processes
* Serves as a function\-wide subject matter expert in one or more areas of focus
* Actively contributes to the engineering community as an advocate of firmwide frameworks, tools, and practices of the Software Development Life Cycle
* Influences peers and project decision\-makers to consider the use and application of leading\-edge technologies
* Adds to the team culture of diversity, equity, inclusion, and respect

**Required qualifications, capabilities, and skills**

* Formal training or certification on software engineering concepts and 5\+ years applied experience
* Extensive experience in software development, with a strong focus on Java applications and related technologies such as Kafka and Oracle.
* Proven expertise in distributed computing, with a deep understanding of scalability, availability, and consistency concerns.
* Strong system architecture skills, capable of designing and implementing robust, high\-performance systems.
* Ability to establish and manage application contracts with other systems interacting with our payment system.
* Demonstrated leadership in owning and managing a large portfolio of applications, with the ability to oversee 90\+ applications effectively.
* Experience in payment systems or financial technology, with a solid understanding of industry standards and best practices.
* Excellent problem\-solving skills, with the ability to address complex technical challenges and drive innovative solutions.
* Strong communication skills, capable of articulating technical concepts to both technical and non\-technical stakeholders.
* Experience with cloud technologies and microservices architecture, with a focus on building scalable and resilient systems.
* Commitment to maintaining high\-quality code standards and practices, with a focus on performance optimization and security.




**Preferred qualifications, capabilities, and skills**

* Experience with advanced data processing and analytics using technologies such as Apache Spark or Hadoop, enhancing the ability to handle large\-scale data within payment systems.
* Familiarity with DevOps practices and tools, such as Docker, Kubernetes, and CI/CD pipelines, to streamline development and deployment processes.
* Prior experience in leading cross\-functional teams and projects, demonstrating the ability to collaborate effectively across different departments and drive strategic initiatives.


**FEDERAL DEPOSIT INSURANCE ACT:*** This position is subject to Section 19 of the Federal Deposit Insurance Act. As such, an employment offer for this position is contingent on JPMorganChase’s review of criminal conviction history, including pretrial diversions or program entries.




**ABOUT US**  


JPMorganChase, one of the oldest financial institutions, offers innovative financial solutions to millions of consumers, small businesses and many of the world’s most prominent corporate, institutional and government clients under the J.P. Morgan and Chase brands. Our history spans over 200 years and today we are a leader in investment banking, consumer and small business banking, commercial banking, financial transaction processing and asset management.
We offer a competitive total rewards package including base salary determined based on the role, experience, skill set and location. Those in eligible roles may receive commission\-based pay and/or discretionary incentive compensation, paid in the form of cash and/or forfeitable equity, awarded in recognition of individual achievements and contributions. We also offer a range of benefits and programs to meet employee needs, based on eligibility. These benefits include comprehensive health care coverage, on\-site health and wellness centers, a retirement savings plan, backup childcare, tuition reimbursement, mental health support, financial coaching and more. Additional details about total compensation and benefits will be provided during the hiring process.


We recognize that our people are our strength and the diverse talents they bring to our global workforce are directly linked to our success. We are an equal opportunity employer and place a high value on diversity and inclusion at our company. We do not discriminate on the basis of any protected attribute, including race, religion, color, national origin, gender, sexual orientation, gender identity, gender expression, age, marital or veteran status, pregnancy or disability, or any other basis protected under applicable law. We also make reasonable accommodations for applicants’ and employees’ religious practices and beliefs, as well as mental health or physical disability needs. Visit our FAQs for more information about requesting an accommodation.


JPMorgan Chase \& Co. is an Equal Opportunity Employer, including Disability/Veterans

  

  

  

**ABOUT THE TEAM**  

  

J.P. Morgan’s Commercial \& Investment Bank is a global leader across banking, markets, securities services and payments. Corporations, governments and institutions throughout the world entrust us with their business in more than 100 countries. The Commercial \& Investment Bank provides strategic advice, raises capital, manages risk and extends liquidity in markets around the world.",,https://www.indeed.com/cmp/Jpmorganchase-2,https://d2q79iu7y748jz.cloudfront.net/s/_squarelogo/256x256/62e186e96c7550325814ef6880fae379,https://www.jpmorganchase.com/,"New York, NY","10,000+",more than $10B (USD),"Headquartered in New York City, JPMorgan Chase is the largest bank in the United States.",,,,,,
in-b4dbce146ba0e9b4,indeed,https://www.indeed.com/viewjob?jk=b4dbce146ba0e9b4,https://www.careers.peraton.com/jobs/software-engineering-associate-santa-clara-california-156742-jobs--information-technology--,"Software Engineering, Associate",Peraton,"Santa Clara, CA, US",2025-05-08,fulltime,direct_data,yearly,66000.0,106000.0,USD,False,,,,,"**About Peraton**  

Peraton is a next\-generation national security company that drives missions of consequence spanning the globe and extending to the farthest reaches of the galaxy. As the world's leading mission capability integrator and transformative enterprise IT provider, we deliver trusted, highly differentiated solutions and technologies to protect our nation and allies. Peraton operates at the critical nexus between traditional and nontraditional threats across all domains: land, sea, space, air, and cyberspace. The company serves as a valued partner to essential government agencies and supports every branch of the U.S. armed forces. Each day, our employees do the can't be done by solving the most daunting challenges facing our customers. Visit peraton.com to learn how we're keeping people around the world safe and secure.  

  

**Program Overview**  

Provide warfighters with reliable strike planning and execution tools for Theater Missile Programs while modernizing and expanding beyond Tomahawk missiles. Our work includes developing and maintaining proprietary software, offering full lifecycle support from design to deployment, and ensuring compliance with cybersecurity standards.  

  

**About The Role**  

  

Peraton is looking to hire Software Engineer supporting the Tomahawk Weapon Systems(TWS) in Santa Clara, CA. This is an onsite position.
  

  

In support of the US Navy, Peraton develops 5 of the 7 components of The Theater Mission Planning Center (TMPC). TMPC is the mission planning segment of the Tomahawk Weapon System that provides precision targeting, route planning, mission distribution, and strike management of Tomahawk cruise missile missions from sites located ashore and afloat. TMPC optimizes all aspects of the Tomahawk missile mission to successfully engage a target.
  

  

What you'll do:
  

  

* Assist in the development and implementation of microservices architecture to modernize systems for Navy Sailors.
* Work closely with senior developers to understand project requirements and contribute to the development process.
* Collaborate with cross\-functional teams to support the integration and delivery of solutions.

Gain proficiency in Angular, C\#, and PostgreSQL to contribute to the development of applications.
  

* Learn about containerization strategies to support application deployment and security.
* Assist in ensuring compliance with security protocols and DevSecOps practices.
* Participate in Agile development processes following Scaled Agile Framework (SAFe) methodologies.
* Communicate with stakeholders to provide updates on project progress and address technical challenges.

**Qualifications**  

  

* Education: Bachelor's degree in Computer Science or related field or 4 years industry experience in lieu of a degree
* Proficiency in at least one modern software language
* Familiarity with software development lifecycle through coursework or internships.
* Exposure to Windows or Linux software development technologies is a plus (Angular, C\#, .NET Core).
* Basic understanding of automated testing techniques.

Interest in UI/UX design.
  

* Clearance: Must be a US Citizen and have the ability to obtain a Secret Clearance

Desired Qualifications:
  

  

* Exposure to transforming legacy systems to Microservice Architecture.
* Familiarity with DevOps principles.
* Basic understanding of Agile development methodology.

  

**SCA / Union / Intern Rate or Range**  

  

**Details**  

  

Target Salary Range: $66,000 \- $106,000\. This represents the typical salary range for this position based on experience and other factors.
  

  

**EEO:** Equal opportunity employer, including disability and protected veterans, or other characteristics protected by law.",,https://www.indeed.com/cmp/Peraton,https://d2q79iu7y748jz.cloudfront.net/s/_squarelogo/256x256/17f78018a9eb9d3f0c36b62451243f5c,http://www.peraton.com,"Reston, VA","10,000+",$5B to $10B (USD),"We're a national security company doing the can't be done, and want you to join us in solving interconnected challenges.",,,,,,
