id,site,job_url,job_url_direct,title,company,location,date_posted,job_type,salary_source,interval,min_amount,max_amount,currency,is_remote,job_level,job_function,listing_type,emails,description,company_industry,company_url,company_logo,company_url_direct,company_addresses,company_num_employees,company_revenue,company_description,skills,experience_range,company_rating,company_reviews_count,vacancy_count,work_from_home_type
in-ac14689b9c14ff61,indeed,https://www.indeed.com/viewjob?jk=ac14689b9c14ff61,https://careers.amperecomputing.com/jobs/16091086-ai-compiler-software-engineer?tm_job=AC-2939&tm_event=view&tm_company=12892,AI Compiler Software Engineer,Ampere Computing,"Santa Clara, CA, US",2025-05-07,fulltime,direct_data,yearly,140500.0,234500.0,USD,False,,,,,"**Description**  



  

  

  

  

  

  

  

Invent the future with us.  

  

Recognized by Fast Company’s 2023 100 Best Workplaces for Innovators List, Ampere is a semiconductor design company for a new era, leading the future of computing with an innovative approach to CPU design focused on high\-performance, energy efficient, sustainable cloud computing. By providing a new level of predictable performance, efficiency, and sustainability Ampere is working with leading cloud suppliers and a growing partner ecosystem to deliver cloud instances, servers and embedded/edge products that can handle the compute demands of today and tomorrow.  

  

Join us at Ampere and work alongside a passionate and growing team — we’d love to have you apply!  

  

The Role:  

Ampere is looking for an enthusiastic and highly\-skilled AI Compiler Engineer to join our expanding Compiler Team. In this role, you will develop advanced compilers for Ampere's upcoming AmpereOne Aurora products. Your responsibilities will be making substantial contributions to entire AI compiler toolchain, which may include language extension, IR lowering, code generation and compiler related optimizations. You will have a chance to work closely with Ampere’s architecture and performance teams to develop a “best in class” algorithm\-compiler\-hardware ecosystem.  

  

What you'll achieve:  

* + Successfully develop and deliver a functional AI compiler (either ahead\-of\-time or just\-in\-time) along with an associated runtime environment, ensuring robust performance and reliability.
	+ Drive the Ampere Computing AI compiler software development, showcase innovation and excellence in Ampere’s compiler technology.
	+ Work hand\-in\-hand with the architecture team to enhance the Ampere Aurora AI accelerator, contributing to cutting\-edge hardware\-software integration.
	+ Design and implement advanced solutions and enhancements for prominent machine learning ecosystems such as PyTorch, JAX, vLLM, and ONNX (C\+\+), significantly boosting their performance and capabilities.
	+ Conduct in\-depth analyses of AI related compiler optimizations and process, leading to substantial performance improvements.

  

  

About you:  

* Bachelors degree in Electrical Engineering, Computer Engineering, Computer Science or a related technical field \& 8 years of related experience; or Master's degree \& 6 years
* Strong Proficiency in C/C\+\+ and Python Languages: Bring your expertise and passion for programming with at least 6 years of hands\-on experience in C/C\+\+ and Python.
* Knowledge of compiler technologies: Strong experience in control flow and data flow analysis, and typical compiler optimizations and IR lowering.
* Familiarity of MLIR dialect and LLVM IR: Minimum 5 years of LLVM related compiler development experience is required in this position.
* Understand Machine Learning and Deep Learning: Hands\-on experience in popular frameworks such as PyTorch, TensorFlow, Llama.cpp, and vLLM.
* Knowledge of Essential Tools: Demonstrate your command of vital development tools such as Linux, and Git, ensuring smooth, efficient workflows and high\-quality results.
* Adaptability in a Startup Environment: Thrive in our fast\-paced, dynamic startup culture where your ability to take initiative and achieve impactful results is highly valued and rewarded.

  

What we’ll offer:  

  

At Ampere we believe in taking care of our employees and providing a competitive total rewards package that includes base pay, bonus (i.e., variable pay tied to internal company goals), long\-term incentive, and comprehensive benefits. The full base pay range for this role is between $140,500 and $234,500, except in the San Francisco Bay Area where the range is between $152,500 and $254,000\.  

  

Our benefits include health, wellness, and financial programs that support employees through every stage of life, with full benefits eligibility at 20 hours per week.  

  

Benefit highlights include:  

* Premium medical insurance, dental insurance, vision insurance, as well as income protection and a 401K retirement plan, so that you can feel secure in your health and financial future.
* Unlimited Flextime and 10\+ paid holidays so that you can embrace a healthy work\-life balance.
* A variety of healthy snacks, energizing espresso, and refreshing drinks to keep you fueled and focused throughout the day.

  

And there is much more than compensation and benefits. At Ampere, we foster an inclusive culture that empowers our employees to do more and grow more. We are passionate about inventing industry leading cloud\-native designs that contribute to a more sustainable future. We are excited to share more about our career opportunities with you through the interview process.  

  

\#LI\-DR  

\#LI\-Hybrid  

  

Ampere is an inclusive and equal opportunity employer and welcomes applicants from all backgrounds. All qualified applicants will receive consideration for employment without regard to race, color, national origin, citizenship, religion, age, veteran and/or military status, sex, sexual orientation, gender, gender identity, gender expression, physical or mental disability, or any other basis protected by federal, state or local law.",,https://www.indeed.com/cmp/Ampere-Computing,https://d2q79iu7y748jz.cloudfront.net/s/_squarelogo/256x256/4f5c4121759c47cc52a5524154cc9610,http://www.amperecomputing.com,"Santa Clara, CA","1,001 to 5,000",Decline to state,"Ampere is a semiconductor design company for a new era, leading the future of computing with an innovative approach to CPU design focused on high-performance, energy efficiency and sustainability.",,,,,,
in-8f278d41e1af284b,indeed,https://www.indeed.com/viewjob?jk=8f278d41e1af284b,https://www2.jobdiva.com/candidates/myjobs/openjob_outside.jsp?a=gqjdnwjcebrekv6n9h8rbmzzvmztk50234z9012psk4xgcxd6b4y7ufhtefg6g6v&from=COMP&id=25493316&SearchString=&StatesString=,NodeJS and GraphQL Developer,BayOne Solutions,"Sunnyvale, CA, US",2025-05-07,contract,direct_data,yearly,105407.0,131097.0,USD,False,,,,,"Node.js and Garph QL developers.
  
  

we need GC or a citizen
  
  

3 Headcounts \- 2 Contract and 1 Contract to Hire",,https://www.indeed.com/cmp/Bayone-Solutions,https://d2q79iu7y748jz.cloudfront.net/s/_squarelogo/256x256/46fab688f1c649df8151425905d08862,https://bayone.com/,Pleasanton,"1,001 to 5,000",$5M to $25M (USD),,,,,,,
in-339c17cf44b2f22b,indeed,https://www.indeed.com/viewjob?jk=339c17cf44b2f22b,https://jobs.itsmfleaders.org/job/78j8lc/senior-manager-software-engineering-capital-one-software/san-francisco/ca,"Senior Manager, Software Engineering - Capital One Software",Information Technology Senior Management Forum,"San Francisco, CA, US",2025-05-07,fulltime,direct_data,yearly,245900.0,280600.0,USD,False,,,,"RecruitingAccommodation@capitalone.com, Careers@capitalone.com, RecruitingAccommodation@capitalone.com, Careers@capitalone.com","Posted Date


5/07/2025


Description


Senior Manager, Software Engineering \- Capital One Software
Ever since our first credit card customer in 1994, Capital One has recognized that technology and data can enable even large companies to be innovative and personalized. As one of the first large enterprises to go all\-in on the public cloud, Capital One needed to build cloud and data management tools that didn’t exist in the marketplace to enable us to operate at scale in the cloud. And in 2022, we publicly announced Capital One Software and brought our first B2B software solution, Slingshot, to market.


Building on Capital One’s pioneering adoption of modern cloud and data capabilities, Capital One Software is helping accelerate the data management journey at scale for businesses operating in the cloud. If you think of the kind of challenges that companies face – things like data publishing, data consumption, data governance, and infrastructure management – we’ve built tools to address these various needs along the way. Capital One Software will continue to explore where we can bring our solutions to market to help other businesses address these same needs going forward.

  

We are seeking top tier talent to join our pioneering team and propel us towards our destination. You will be joining a team of innovative product, tech, and design leaders that tirelessly seek to question the status quo. As a Capital One Senior Manager, Software Engineering, you’ll have the opportunity to be on the forefront of building this business and bring these tools to market.

**What You’ll Do:**

* Lead a portfolio of diverse technology projects and a team of developers with deep experience in distributed microservices, and full stack systems to create solutions that help meet regulatory needs for the company
* Share your passion for staying on top of tech trends, experimenting with and learning new technologies, participating in internal \& external technology communities, mentoring other members of the engineering community, and from time to time, be asked to code or evaluate code
* Collaborate with digital product managers, and deliver robust cloud\-based solutions that drive powerful experiences to help millions of Americans achieve financial empowerment
* Utilize programming languages like JavaScript, Java, HTML/CSS, TypeScript, SQL, Python, and Go, Open Source RDBMS and NoSQL databases, Container Orchestration services including Docker and Kubernetes, and a variety of AWS tools and services

**Basic Qualifications:**

* Bachelor’s Degree
* At least 6 years of experience in software engineering (Internship experience does not apply)
* At least 1 year experience with cloud computing (AWS, Microsoft Azure, Google Cloud)
* At least 4 years of people management experience

**Preferred Qualifications:**

* Master’s Degree
* 9\+ years of experience in at least one of the following: JavaScript, Java, TypeScript, SQL, Python, or Go
* 3\+ years of experience with AWS, GCP, Microsoft Azure, or another cloud service
* 4\+ years of experience in open source frameworks
* 7\+ years of people management experience
* 2\+ years of experience in Agile practices

***Capital One will consider sponsoring a new qualified applicant for employment authorization for this position.***


The minimum and maximum full\-time annual salaries for this role are listed below, by location. Please note that this salary information is solely for candidates hired to perform work within one of these locations, and refers to the amount Capital One is willing to pay at the time of this posting. Salaries for part\-time roles will be prorated based upon the agreed upon number of hours to be regularly worked.


San Francisco, CA: $245,900 \- $280,600 for Sr. Mgr, Software Engineering  

Candidates hired to work in other locations will be subject to the pay range associated with that location, and the actual annualized salary amount offered to any candidate at the time of hire will be reflected solely in the candidate’s offer letter.


This role is also eligible to earn performance based incentive compensation, which may include cash bonus(es) and/or long term incentives (LTI). Incentives could be discretionary or non discretionary depending on the plan.
Capital One offers a comprehensive, competitive, and inclusive set of health, financial and other benefits that support your total well\-being. Learn more at the Capital One Careers website. Eligibility varies based on full or part\-time status, exempt or non\-exempt status, and management level.


This role is expected to accept applications for a minimum of 5 business days.No agencies please. Capital One is an equal opportunity employer committed to diversity and inclusion in the workplace. All qualified applicants will receive consideration for employment without regard to sex (including pregnancy, childbirth or related medical conditions), race, color, age, national origin, religion, disability, genetic information, marital status, sexual orientation, gender identity, gender reassignment, citizenship, immigration status, protected veteran status, or any other basis prohibited under applicable federal, state or local law. Capital One promotes a drug\-free workplace. Capital One will consider for employment qualified applicants with a criminal history in a manner consistent with the requirements of applicable laws regarding criminal background inquiries, including, to the extent applicable, Article 23\-A of the New York Correction Law; San Francisco, California Police Code Article 49, Sections 4901\-4920; New York City’s Fair Chance Act; Philadelphia’s Fair Criminal Records Screening Act; and other applicable federal, state, and local laws and regulations regarding criminal background inquiries.
If you have visited our website in search of information on employment opportunities or to apply for a position, and you require an accommodation, please contact Capital One Recruiting at 1\-800\-304\-9102 or via email at RecruitingAccommodation@capitalone.com. All information you provide will be kept confidential and will be used only to the extent required to provide needed reasonable accommodations.


For technical support or questions about Capital One's recruiting process, please send an email to Careers@capitalone.com


Capital One does not provide, endorse nor guarantee and is not liable for third\-party products, services, educational tools or other information available through this site.


Capital One Financial is made up of several different entities. Please note that any position posted in Canada is for Capital One Canada, any position posted in the United Kingdom is for Capital One Europe and any position posted in the Philippines is for Capital One Philippines Service Corp. (COPSSC).


Senior Manager, Software Engineering \- Capital One Software
Ever since our first credit card customer in 1994, Capital One has recognized that technology and data can enable even large companies to be innovative and personalized. As one of the first large enterprises to go all\-in on the public cloud, Capital One needed to build cloud and data management tools that didn’t exist in the marketplace to enable us to operate at scale in the cloud. And in 2022, we publicly announced Capital One Software and brought our first B2B software solution, Slingshot, to market.


Building on Capital One’s pioneering adoption of modern cloud and data capabilities, Capital One Software is helping accelerate the data management journey at scale for businesses operating in the cloud. If you think of the kind of challenges that companies face – things like data publishing, data consumption, data governance, and infrastructure management – we’ve built tools to address these various needs along the way. Capital One Software will continue to explore where we can bring our solutions to market to help other businesses address these same needs going forward.

  

We are seeking top tier talent to join our pioneering team and propel us towards our destination. You will be joining a team of innovative product, tech, and design leaders that tirelessly seek to question the status quo. As a Capital One Senior Manager, Software Engineering, you’ll have the opportunity to be on the forefront of building this business and bring these tools to market.

**What You’ll Do:**

* Lead a portfolio of diverse technology projects and a team of developers with deep experience in distributed microservices, and full stack systems to create solutions that help meet regulatory needs for the company
* Share your passion for staying on top of tech trends, experimenting with and learning new technologies, participating in internal \& external technology communities, mentoring other members of the engineering community, and from time to time, be asked to code or evaluate code
* Collaborate with digital product managers, and deliver robust cloud\-based solutions that drive powerful experiences to help millions of Americans achieve financial empowerment
* Utilize programming languages like JavaScript, Java, HTML/CSS, TypeScript, SQL, Python, and Go, Open Source RDBMS and NoSQL databases, Container Orchestration services including Docker and Kubernetes, and a variety of AWS tools and services

**Basic Qualifications:**

* Bachelor’s Degree
* At least 6 years of experience in software engineering (Internship experience does not apply)
* At least 1 year experience with cloud computing (AWS, Microsoft Azure, Google Cloud)
* At least 4 years of people management experience

**Preferred Qualifications:**

* Master’s Degree
* 9\+ years of experience in at least one of the following: JavaScript, Java, TypeScript, SQL, Python, or Go
* 3\+ years of experience with AWS, GCP, Microsoft Azure, or another cloud service
* 4\+ years of experience in open source frameworks
* 7\+ years of people management experience
* 2\+ years of experience in Agile practices

***Capital One will consider sponsoring a new qualified applicant for employment authorization for this position.***


The minimum and maximum full\-time annual salaries for this role are listed below, by location. Please note that this salary information is solely for candidates hired to perform work within one of these locations, and refers to the amount Capital One is willing to pay at the time of this posting. Salaries for part\-time roles will be prorated based upon the agreed upon number of hours to be regularly worked.


San Francisco, CA: $245,900 \- $280,600 for Sr. Mgr, Software Engineering  

Candidates hired to work in other locations will be subject to the pay range associated with that location, and the actual annualized salary amount offered to any candidate at the time of hire will be reflected solely in the candidate’s offer letter.


This role is also eligible to earn performance based incentive compensation, which may include cash bonus(es) and/or long term incentives (LTI). Incentives could be discretionary or non discretionary depending on the plan.
Capital One offers a comprehensive, competitive, and inclusive set of health, financial and other benefits that support your total well\-being. Learn more at the Capital One Careers website. Eligibility varies based on full or part\-time status, exempt or non\-exempt status, and management level.


This role is expected to accept applications for a minimum of 5 business days.No agencies please. Capital One is an equal opportunity employer committed to diversity and inclusion in the workplace. All qualified applicants will receive consideration for employment without regard to sex (including pregnancy, childbirth or related medical conditions), race, color, age, national origin, religion, disability, genetic information, marital status, sexual orientation, gender identity, gender reassignment, citizenship, immigration status, protected veteran status, or any other basis prohibited under applicable federal, state or local law. Capital One promotes a drug\-free workplace. Capital One will consider for employment qualified applicants with a criminal history in a manner consistent with the requirements of applicable laws regarding criminal background inquiries, including, to the extent applicable, Article 23\-A of the New York Correction Law; San Francisco, California Police Code Article 49, Sections 4901\-4920; New York City’s Fair Chance Act; Philadelphia’s Fair Criminal Records Screening Act; and other applicable federal, state, and local laws and regulations regarding criminal background inquiries.
If you have visited our website in search of information on employment opportunities or to apply for a position, and you require an accommodation, please contact Capital One Recruiting at 1\-800\-304\-9102 or via email at RecruitingAccommodation@capitalone.com. All information you provide will be kept confidential and will be used only to the extent required to provide needed reasonable accommodations.


For technical support or questions about Capital One's recruiting process, please send an email to Careers@capitalone.com


Capital One does not provide, endorse nor guarantee and is not liable for third\-party products, services, educational tools or other information available through this site.


Capital One Financial is made up of several different entities. Please note that any position posted in Canada is for Capital One Canada, any position posted in the United Kingdom is for Capital One Europe and any position posted in the Philippines is for Capital One Philippines Service Corp. (COPSSC).


Salary


245,900\.00 \- 280,600\.00 Annual


Type


Full\-time",,https://www.indeed.com/cmp/Information-Technology-Senior-Management-Forum,,http://www.itsmfonline.org,Atlanta,51 to 200,,,,,,,,
in-1ec295e187cc40d0,indeed,https://www.indeed.com/viewjob?jk=1ec295e187cc40d0,https://bonfy-ai.breezy.hr/p/841205662908-senior-machine-learning-engineer?source=indeed,Senior Machine Learning Engineer,,"Mountain View, CA, US",2025-05-01,fulltime,direct_data,yearly,158298.0,200441.0,USD,False,,,,,"**Bonfy.AI \| Mountain View, CA \| Hybrid**


*Security for the Age of AI*


### **About Us**


At Bonfy.AI, we're building the trust layer for generative AI. Our Adaptive Content Security platform detects and mitigates subtle risks baked into large language model (LLM) outputs—before they make it to the user. From hallucinations to hidden data leaks, we help enterprises use GenAI without compromising truth, privacy, or reputation.


We're model\-agnostic, outcome\-focused, and unapologetically rigorous. Our customers include Fortune 500 teams deploying LLMs in high\-stakes domains—where trust isn't optional.


### **Why This Role Matters**


We're looking for an engineer who wants to go deeper than metrics—someone who can analyze model behavior, identify subtle failure modes, and build real\-time systems that make AI safer to use. You won't be tuning models for leaderboard glory; you'll be making them safer, traceable, and accountable. This is a chance to shape the foundation of how the world trusts AI.


### **What You'll Do**


* Design and build tools that evaluate and improve LLM behavior across diverse use cases
* Define and evolve trust metrics that go beyond accuracy — including traceability, robustness under edge cases, and interpretability of model decisions.
* Work across teams—infra, product, security—to embed ML insights into a cohesive content safety experience.
* Help us define and refine trust metrics beyond accuracy: traceability, brittleness, interpretability.


### **What We're Looking For**


* Hands\-on experience working with modern NLP systems in real\-world contexts (LLMs, embeddings, transformers, etc.).
* Comfort moving from prototype to production in Python—outside the notebook.
* Experience building or working with evaluation frameworks and pipelines.
* Practical thinking, sharp debugging skills, and an appetite for ambiguity.


### **Bonus Points For:**


* Experience using or building tools that evaluate the behavior of language models (LLMs).
* Background in environments where trust, safety, or compliance is critical—even if outside traditional “regulated” industries.
* Hands\-on experience testing AI systems for edge cases, failure modes, or unexpected behavior.


### **Why Join Us**


* You'll have technical autonomy and direct exposure to customer use cases.
* We're early\-stage, well\-funded, and mission\-driven—your code will shape our trajectory.
* We believe in clarity, urgency, and respect. We value what you ship, not how loud you are.
* You'll work with a sharp, kind, high\-trust team that knows what's at stake.


### **Compensation \& Benefits**


Competitive salary. Generous equity. Flexible hybrid schedule. Health, vision, and dental coverage. And most importantly: a chance to build something meaningful during the most critical phase of AI's evolution.


### **Apply If...**


* ### **You believe safety isn't just an add\-on—it's essential to how AI is built.**
* ### **You understand that trust in AI must be demonstrated through evidence, not assumed by design.**
* ### **You're willing to question conventional approaches when they fall short.**
* ### **You want to contribute meaningfully to the evolution of responsible AI, not just follow established paths.**


*Bonfy.AI — Truth. Security. Intelligence.*",,,,,,,,,,,,,,
li-4207666895,linkedin,https://www.linkedin.com/jobs/view/4207666895,,Analytics Engineer (L4) - Acquisition,Netflix,"Los Gatos, CA",2025-05-07,,,,,,,False,,,,,,,https://www.linkedin.com/company/netflix,,,,,,,,,,,,
li-4189704874,linkedin,https://www.linkedin.com/jobs/view/4189704874,,Software Engineer I,Affirm,"Palo Alto, CA",2025-05-07,,,,,,,False,,,,,,,https://www.linkedin.com/company/affirm,,,,,,,,,,,,
li-4224858124,linkedin,https://www.linkedin.com/jobs/view/4224858124,,Software Engineer - Frontend,MotherDuck,"San Francisco, CA",2025-05-07,,,,,,,False,,,,,,,https://www.linkedin.com/company/motherduck,,,,,,,,,,,,
